start,end,Anketè,Dat,Komin (Pa/Pe),Seksyon Kominal (4PR/2Pa),Lokalite / Bitasyon,Q0 - Eske w’ dakò patisipe nan anket sa a ak nou?,Q1 - Non ak Siyati moun k’ap reponn nan,Q2 – Sèks,Q3 - Nan ki entèval laj ou sitiye ?  ,Q4 - Ki nivo edikasyon w,Q5 - Ou gen telefòn Digicel ?,"Q5.1 - Si wi, Ki nimewo telefòn sa a?",Q5.2 - Si wi eske ou gen yon kont MonCash sou nimewo sa a ?,Q6 - Ki prensipal aktivite ou fe pou w viv? ,Q6 - Ki prensipal aktivite ou fe pou w viv? /Agrikilti,Q6 - Ki prensipal aktivite ou fe pou w viv? /Elvaj,Q6 - Ki prensipal aktivite ou fe pou w viv? /Chabon ak bwa mang,Q6 - Ki prensipal aktivite ou fe pou w viv? /Chabon ak lòt bwa,Q6 - Ki prensipal aktivite ou fe pou w viv? /Lòt (Presize),Presizyon 1 Lòt (Q6),Presizyon 2 Lòt (Q6),Presizyon 3 Lòt (Q6),Q7 - Kisa mangwòv Bondeau (oubyen mang) a ye selon oumenm ?,Q8 - Eske ou konnen lwa oubyen règleman ki pale de mangwov (mang) ?,"Q8.1 - Si wi, kiyès ?","Q8.1 - Si wi, kiyès ?/Kòd riral ","Q8.1 - Si wi, kiyès ?/Dekrè sou anviwonman (2005) ","Q8.1 - Si wi, kiyès ?/Dekrè sou mangwòv (2013)","Q8.1 - Si wi, kiyès ?/Lòt (Presize) ",Presizyon 1 Lòt (Q8.1),Presizyon 2 Lòt (Q8.1),Presizyon 3 Lòt (Q8.1),Q8.1.1 - Eskew konn kisa lwa sa yo di sou zafe pwoteksyon mangwov ?,Q8.1.1.1- ki sa lwa yo di ? ,Q8.1.1.1- ki sa lwa yo di ? /Pa fè kay nan mangwòv,Q8.1.1.1- ki sa lwa yo di ? /Pa koute mangwòv yo,Q8.1.1.1- ki sa lwa yo di ? /Pa jete fatra/dechè plastik/vye materyo konstriksyon nan mangwòv yo ,Q8.1.1.1- ki sa lwa yo di ? /Lòt (Presize),Presizyon 1 Lòt (Q8.1.1.1),Presizyon 2 Lòt (Q8.1.1.1),Presizyon 3 Lòt (Q8.1.1.1),Q9 - Ki enpotans ou konnen mang lan genyen ?,Q9 - Ki enpotans ou konnen mang lan genyen ?/Li kontribiye ak bay sekirite alimantè (gras ak pwodwi pèch li ofri yo),Q9 - Ki enpotans ou konnen mang lan genyen ?/Pwoteksyon konn inondasyon ,Q9 - Ki enpotans ou konnen mang lan genyen ?/Pwoteksyon kot yo ak resif yo,Q9 - Ki enpotans ou konnen mang lan genyen ?/Se espas kote anpil zwazo viv ak repwodwi,"Q9 - Ki enpotans ou konnen mang lan genyen ?/Refij pou fwi lame (kòm pwason, krab ak sirik) repwodwi oubyen grandi ",Q9 - Ki enpotans ou konnen mang lan genyen ?/Lòt (Presize),Q9 - Ki enpotans ou konnen mang lan genyen ?/Mwen pa konnen,Presizyon 1 Lòt (Q9),Presizyon 2 Lòt (Q9),Presizyon 3 Lòt (Q9),"Q10 - Daprè ou, èske mang lan an danje ?",Q10.1 Poukisa selon ou mang lan an danje ? ,Q10.1 Poukisa selon ou mang lan an danje ? /Leta a pa prezan/pa gen kontwòl nan jan moun ap eksplwate mangwòv yo,Q10.1 Poukisa selon ou mang lan an danje ? /Kominote ap mal eksplwate mangwòv yo (Yo koupe yo twòp pou fe chabon ak kay),Q10.1 Poukisa selon ou mang lan an danje ? /Mangwòv yo ap fin konble ak tè ki soti nan tèt mòn yo akoz ewozyon ,Q10.1 Poukisa selon ou mang lan an danje ? /Nivo lamè a ap bese lakoz gen plantasyon mangwòv ki ap fin seche,"Q10.1 Poukisa selon ou mang lan an danje ? /Moun yo ap konstwi kay nan espas kote ki ta dwe gen mang selman, ","Q10.1 Poukisa selon ou mang lan an danje ? /Yo jete anpil fatra (dechè plastik, vye materyo konstriksyon) nan espas mangwòv yo ",Q10.1 Poukisa selon ou mang lan an danje ? /Lòt (Presize),Presizyon1 Lòt (Q10.1),Presizyon2 Lòt (Q10.1),Presizyon3 Lòt (Q10.1),Q11 - Eske ou konnen ki aksyon oubyen mezi ki ka pwoteje mang lan ?,Q11.1 Kisa ki kap fèt pou pwoteje mangwòv yo selon ou ? ,Q11.1 Kisa ki kap fèt pou pwoteje mangwòv yo selon ou ? /Elabore yon plan jesyon ak amenajman kominotè ,Q11.1 Kisa ki kap fèt pou pwoteje mangwòv yo selon ou ? /Met sou pye yon komite jesyon,Q11.1 Kisa ki kap fèt pou pwoteje mangwòv yo selon ou ? /Itilize espas mangwòv yo pou bay moun yo lot resous tankou elvaj myèl,Q11.1 Kisa ki kap fèt pou pwoteje mangwòv yo selon ou ? /Plante plis mang ,Q11.1 Kisa ki kap fèt pou pwoteje mangwòv yo selon ou ? /Valorize espas ak resous li yo atravè aktivite touris,Q11.1 Kisa ki kap fèt pou pwoteje mangwòv yo selon ou ? /Edikasyon ak sansibilizsyon popilasyon an sou jan yo dwe eksplwate l,Q11.1 Kisa ki kap fèt pou pwoteje mangwòv yo selon ou ? /Mete an aplikasyon lwa ak reglemantasyon sou mangwòv yo ,Q11.1 Kisa ki kap fèt pou pwoteje mangwòv yo selon ou ? /Konsèvasyon sòl nan mòn yo ak rebwazman nan basen vesan an ,Q11.1 Kisa ki kap fèt pou pwoteje mangwòv yo selon ou ? /Itilize materyèl pèch ki pi dirab,Q11.1 Kisa ki kap fèt pou pwoteje mangwòv yo selon ou ? /Lòt (Presize),Presizyon 1 Lòt (Q11.1),Presizyon 2 Lòt (Q11.1),Presizyon Lòt 3 (Q11.1),Q12 – Ki kilti ou pi byen konn pratike ?,Q12 – Ki kilti ou pi byen konn pratike ?/Mayi,Q12 – Ki kilti ou pi byen konn pratike ?/Pitimi,Q12 – Ki kilti ou pi byen konn pratike ?/Pistach,Q12 – Ki kilti ou pi byen konn pratike ?/Pwa Kongo,Q12 – Ki kilti ou pi byen konn pratike ?/Pwa (pwa nwa ak lot varyete),Q12 – Ki kilti ou pi byen konn pratike ?/Vetivè,Q12 – Ki kilti ou pi byen konn pratike ?/Yanm,Q12 – Ki kilti ou pi byen konn pratike ?/Bannann,Q12 – Ki kilti ou pi byen konn pratike ?/Sitwon,Q12 – Ki kilti ou pi byen konn pratike ?/Lòt (Presize),Presizyon 1 Lòt (Q12),Presizyon 2 Lòt (Q12),Presizyon 3 Lòt (Q12),Q13- Ki enpòtans ou konnen yon pye bwa genyen ?,Q13- Ki enpòtans ou konnen yon pye bwa genyen ?/Kenbe tè yo kont ewozyon ,Q13- Ki enpòtans ou konnen yon pye bwa genyen ?/Pemèt dlo rantre byen nan tè a,Q13- Ki enpòtans ou konnen yon pye bwa genyen ?/Bay manje pou moun ak bet,Q13- Ki enpòtans ou konnen yon pye bwa genyen ?/Medikaman natirèl,Q13- Ki enpòtans ou konnen yon pye bwa genyen ?/Kontwole tanperati a,Q13- Ki enpòtans ou konnen yon pye bwa genyen ?/Bay oksijèn pou moun respire byen ,Q13- Ki enpòtans ou konnen yon pye bwa genyen ?/Mwen pa konnen,Q13- Ki enpòtans ou konnen yon pye bwa genyen ?/Pwoteksyon kont inondasyon,Q13- Ki enpòtans ou konnen yon pye bwa genyen ?/Pwoteksyon kont gwo van (briz van) ,Q13- Ki enpòtans ou konnen yon pye bwa genyen ?/Lòt (Presize),Presizyon 1 Lòt (Q13),Presizyon 2 Lòt (Q13),Presizyon 3 Lòt (Q13),Q14- Pratik agrikòl – Eske ou konn ?,Q14- Pratik agrikòl – Eske ou konn ?/Plante pistach nan flan mòn yo,"Q14- Pratik agrikòl – Eske ou konn ?/Plante pistach, vetivè, manyòk, yanm ak lot kilti ki kew rache le wap rekolte yo oubye ou fouye te a le wap rekolte yo nan flan mòn yo",Q14- Pratik agrikòl – Eske ou konn ?/Laboure te ki nan flan mòn yo,Q14- Pratik agrikòl – Eske ou konn ?/Fe misek pou pwoteje tè a kont erozyon,Q14- Pratik agrikòl – Eske ou konn ?/Fe ranp vivan pou pwoteje te yo kon ewozyon,Q14- Pratik agrikòl – Eske ou konn ?/Fe kanl koutou pou pemet plis dlo antre nan te a ,Q14- Pratik agrikòl – Eske ou konn ?/Plante pye bwa nan jaden yo,"Q14- Pratik agrikòl – Eske ou konn ?/Plante banbou nan flan mon yo, bo rivye pou kenbe te yo",Q14- Pratik agrikòl – Eske ou konn ?/Koupe pye bwa nan jaden yo,Q14- Pratik agrikòl – Eske ou konn ?/Brile te a ak raje ki ladanl,Q14- Pratik agrikòl – Eske ou konn ?/Mete fimye nan plant yo,Q14- Pratik agrikòl – Eske ou konn ?/Mare bet nan jaden yo pou anrichi te a,Q14- Pratik agrikòl – Eske ou konn ?/Fe lot pratik nan jaden ou yo ,Presizyon 1 Lòt (Q14),Presizyon 2 Lòt (Q14),Presizyon 3 Lòt (Q14),Q15- Eske ou konn koman pou w fe pepinye pou pwodwi pye bwa ?,Q16 - Eske ou prè pou w patisipe nan fòmasyon pou w konn kijan pou w pwoteje chan mangwòv yo ?,Q17 - Eske w ou ta renmen pran fòmasyon pou konnen kijan pou w fe pepinyè pou pwodwi pye bwa ?,Q18 – Eske ou pre pou w chanje fason w’ap fè jaden pou w pwoteje mangwòv yo ?,Q19- Eske w prè pou w adopte lot plant (tankou morenga) pou w ka pwoteje tè yo kont ewozyon?,Q20 – Pandan 12 mwa ki sot pase la yo kiles pami aktivite sa yo ou reyalize nan mangwòv la ?,Q20 – Pandan 12 mwa ki sot pase la yo kiles pami aktivite sa yo ou reyalize nan mangwòv la ?/Sit pèch pou mete bato,"Q20 – Pandan 12 mwa ki sot pase la yo kiles pami aktivite sa yo ou reyalize nan mangwòv la ?/Koupe bwa vèt, ","Q20 – Pandan 12 mwa ki sot pase la yo kiles pami aktivite sa yo ou reyalize nan mangwòv la ?/Koupe bwa sèch, ","Q20 – Pandan 12 mwa ki sot pase la yo kiles pami aktivite sa yo ou reyalize nan mangwòv la ?/Elvaj myèl, ",Q20 – Pandan 12 mwa ki sot pase la yo kiles pami aktivite sa yo ou reyalize nan mangwòv la ?/Peche pwason ak lot bet lanmè ,Q20 – Pandan 12 mwa ki sot pase la yo kiles pami aktivite sa yo ou reyalize nan mangwòv la ?/Lòt (Presize),Presizyon 1 Lòt (Q20),Presizyon 2 Lòt (Q20),Presizyon 3 Lòt (Q20),Q20.1 Poukisa ou koupe mang vèt ?,Q20.1 Poukisa ou koupe mang vèt ?/Pou m fè chabon,Q20.1 Poukisa ou koupe mang vèt ?/Pou m fè kay,Q20.1 Poukisa ou koupe mang vèt ?/Pou m ka libere espas pou m fè kay,Q20.1 Poukisa ou koupe mang vèt ?/Pou m libere espas pou m fe chabon,Q20.1 Poukisa ou koupe mang vèt ?/Pou m libere espas pou m ka fè ban sèl,Q20.1 Poukisa ou koupe mang vèt ?/Lòt (Presize),Presizyon 1 Lòt (Q20.1),Presizyon 2 Lòt (Q20.1),Presizyon 3 Lòt (Q20.1),Q20.2 Poukisa ou koupe mang sèk ?,Q20.2 Poukisa ou koupe mang sèk ?/Pou m fè chabon,Q20.2 Poukisa ou koupe mang sèk ?/Pou fè manje,Q20.2 Poukisa ou koupe mang sèk ?/Pou m fè boulanje travay,Q20.2 Poukisa ou koupe mang sèk ?/Lòt (Presize),Presizyon 1 Lòt (Q20.2),Presizyon 2 Lòt (Q20.2),Presizyon 3 Lòt (Q20.2),Q20.3 – Nan ki peryòd ou konn koupe mang yo ?,Q20.3 – Nan ki peryòd ou konn koupe mang yo ?/Janvye,Q20.3 – Nan ki peryòd ou konn koupe mang yo ?/Fevriye,Q20.3 – Nan ki peryòd ou konn koupe mang yo ?/Mas,Q20.3 – Nan ki peryòd ou konn koupe mang yo ?/Avril,Q20.3 – Nan ki peryòd ou konn koupe mang yo ?/Me,Q20.3 – Nan ki peryòd ou konn koupe mang yo ?/Jen,Q20.3 – Nan ki peryòd ou konn koupe mang yo ?/Jiyè,Q20.3 – Nan ki peryòd ou konn koupe mang yo ?/Out,Q20.3 – Nan ki peryòd ou konn koupe mang yo ?/Septanm,Q20.3 – Nan ki peryòd ou konn koupe mang yo ?/Novanm,Q20.3 – Nan ki peryòd ou konn koupe mang yo ?/Evenman (Presize),Presizyon evenman (Q20.3),Q21 - Kisa ou konn fe ak pye bwa ki nan jadenw?,"Q21 - Kisa ou konn fe ak pye bwa ki nan jadenw?/Rekolte fwi ak fèy pou manje oubyen fè remèd, ","Q21 - Kisa ou konn fe ak pye bwa ki nan jadenw?/Rekòlte fwi oubyen fèy pou bay bèt manje, ",Q21 - Kisa ou konn fe ak pye bwa ki nan jadenw?/Pran bwa sèch pou fè manje,Q21 - Kisa ou konn fe ak pye bwa ki nan jadenw?/Koupe bwa pou fè chabon,Q21 - Kisa ou konn fe ak pye bwa ki nan jadenw?/Koupe bwa pou konstriksyon,Q21 - Kisa ou konn fe ak pye bwa ki nan jadenw?/Lòt (presize),Presizyon 1 Lòt (Q21),Presizyon 2 Lòt (Q21),Presizyon 3 Lòt (Q21),Q22- Eske ou kon plante pye bwa nan jaden w deja ?,Q23 - Eske ou kon wè yon jaden moriga/benzoliv deja ? ,"Q24 - Kisa ou konnen yo fè ak fèy, grenn oubyen flè moringa/benzoliv ?  ","Q24 - Kisa ou konnen yo fè ak fèy, grenn oubyen flè moringa/benzoliv ?  /Mwen pa konnen","Q24 - Kisa ou konnen yo fè ak fèy, grenn oubyen flè moringa/benzoliv ?  /Fèy pou moun manje","Q24 - Kisa ou konnen yo fè ak fèy, grenn oubyen flè moringa/benzoliv ?  /Fèy pou bèt manje  ","Q24 - Kisa ou konnen yo fè ak fèy, grenn oubyen flè moringa/benzoliv ?  /Fèy pou fè poud  ","Q24 - Kisa ou konnen yo fè ak fèy, grenn oubyen flè moringa/benzoliv ?  /Grenn pou fè lwil","Q24 - Kisa ou konnen yo fè ak fèy, grenn oubyen flè moringa/benzoliv ?  /Flè, grenn konn itilize kòm remèd (te) ","Q24 - Kisa ou konnen yo fè ak fèy, grenn oubyen flè moringa/benzoliv ?  /Lòt (Presize)",Presizyon 1 Lot Q24,Presizyon 2 Lot Q24,Presizyon 3 Lot Q24,Q25 - Ou konn plante moringa/benzoliv ? ,Q25.1 - Pou fè kisa ou plante moringa/benzoliv ?,Q25.1 - Pou fè kisa ou plante moringa/benzoliv ?/Kloti,Q25.1 - Pou fè kisa ou plante moringa/benzoliv ?/Manje pou bèt,Q25.1 - Pou fè kisa ou plante moringa/benzoliv ?/Aliman kòm legim,"Q25.1 - Pou fè kisa ou plante moringa/benzoliv ?/Fèy, grenn ak flè pou vann",Q25.1 - Pou fè kisa ou plante moringa/benzoliv ?/Lòt,Lòt (Q25.1),Lòt 2 (Q25.1),Lòt 3 (Q25.1),Q25.2 – Eske w pre pou w plante morenga alavni?,Q25.2.1 Ki kantite espas wap dispoze pou plante moringa ?,Q25.2.1 Ki kantite espas wap dispoze pou plante moringa ?/Yon kawo tè,Q25.2.1 Ki kantite espas wap dispoze pou plante moringa ?/Plis ke yon kawo tè,Q25.2.1 Ki kantite espas wap dispoze pou plante moringa ?/Yon ka tè (1/4),Q25.2.1 Ki kantite espas wap dispoze pou plante moringa ?/Mwens ke yon ka tè,Q25.2.1 Ki kantite espas wap dispoze pou plante moringa ?/M poko gen tè pou sa,Q25.2.1 Ki kantite espas wap dispoze pou plante moringa ?/M poko ka deside ,Q25.2.2 Nan ki bitasyon li ye ?,Q25.2.2 Nan ki bitasyon li ye ?/Bondeau (4e PR),Q25.2.2 Nan ki bitasyon li ye ?/Bezin 4e PR),Q25.2.2 Nan ki bitasyon li ye ?/Bwa pati (4e PR) ,Q25.2.2 Nan ki bitasyon li ye ?/Nan jenn (4e PR) ,Q25.2.2 Nan ki bitasyon li ye ?/Coray (4e PR) ,Q25.2.2 Nan ki bitasyon li ye ?/Nan kokoye (4e PR) ,Q25.2.2 Nan ki bitasyon li ye ?/Djaka (4e PR),Q25.2.2 Nan ki bitasyon li ye ?/Kafoudan (2e P),Q25.2.2 Nan ki bitasyon li ye ?/Lòt,Presizyon 1 Lòt Q25.2.2,Presizyon 2 Lòt Q25.2.2,Presizyon 3 Lòt Q25.2.2,1) Kilti 1,Presizyon Lòt Kilti 1,Kilti 2,Presizyon Lòt Kilti 2,Kilti 3,Presizyon Lòt Kilti 3,Kiti 4,Presizyon Lòt Kilti 4,Kilti 5,Presizyon Lòt Kilti 5,Kilti 6,Presizyon Lòt Kilti 6,Kilti 7,Presizyon Lòt Kilti 7,Kilti 8,Presizyon Lòt Kilti 8,Kilti 9,Presizyon Lòt Kilti 9,Kilti 10,Presizyon 1 (Lòt Kilti 10),Presizyon 2 (Lòt Kilti 10),Presizyon 3 (Lòt Kilti 10),Kilti 1,Kilti 2,Kilti 3,Kilti 4,Kilti 5,Lot kilti 6,Lokalite,"Si wi, Ki nimewo telefòn sa a?",Q7 - Kisa mangwòv (oubyen mang) la ye selon oumenm ?,"Q24 - Kisa ou konnen yo fè ak fèy, grenn oubyen flè moringa/benzoliv ?  ","Q24 - Kisa ou konnen yo fè ak fèy, grenn oubyen flè moringa/benzoliv ?  /Mwen pa konnen","Q24 - Kisa ou konnen yo fè ak fèy, grenn oubyen flè moringa/benzoliv ?  /Fèy pou moun manje","Q24 - Kisa ou konnen yo fè ak fèy, grenn oubyen flè moringa/benzoliv ?  /Fèy pou bèt manje  ","Q24 - Kisa ou konnen yo fè ak fèy, grenn oubyen flè moringa/benzoliv ?  /Fèy pou fè poud  ","Q24 - Kisa ou konnen yo fè ak fèy, grenn oubyen flè moringa/benzoliv ?  /Grenn pou fè lwil","Q24 - Kisa ou konnen yo fè ak fèy, grenn oubyen flè moringa/benzoliv ?  /Flè, grenn konn itilize kòm remèd (te) ","Q24 - Kisa ou konnen yo fè ak fèy, grenn oubyen flè moringa/benzoliv ?  /Lòt (Presize)",Q25.1 - Pou fè kisa ou plante moringa/benzoliv ?,Q25.1 - Pou fè kisa ou plante moringa/benzoliv ?/Manje pou bèt,Q25.1 - Pou fè kisa ou plante moringa/benzoliv ?/Aliman kòm legim,"Q25.1 - Pou fè kisa ou plante moringa/benzoliv ?/Fèy, grenn ak flè pou vann",New Question,Presizyon Lòt Kilti 10, Lòt Kilti 10,Lòt Kilti 10,_id,_uuid,_submission_time,_validation_status,_index
2020-12-28T13:09:35.919-05:00,2021-01-02T11:42:43.923-05:00,Edouard Jinou,2020-12-28,Petite Riviera de nippes,4pr,Bondeau,"Wi, Si wi pase a Q1 ",Rivière Yvrece,Gason,Ant 35 ak 55 lane,Okenn Nivo,Wi,34337833,Non,Agrikilti Elvaj Lòt (Presize),1,1,0,0,1,Mason,,,Se yon rak bwa ki grandi bo lanmè,"Non – Si non, pase a Q9",,,,,,,,,,,,,,,,,,"Refij pou fwi lame (kòm pwason, krab ak sirik) repwodwi oubyen grandi ",0,0,0,0,1,0,0,,,,"Non – Si non, pase a Q11",,,,,,,,,,,,Wi,Edikasyon ak sansibilizsyon popilasyon an sou jan yo dwe eksplwate l Met sou pye yon komite jesyon,0,1,0,0,0,1,0,0,0,0,,,,Mayi Pwa Kongo Pitimi Lòt (Presize),1,1,0,1,0,0,0,0,0,1,Manyok,,,Bay manje pou moun ak bet Pwoteksyon kont inondasyon,0,0,1,0,0,0,0,1,0,0,,,,"Plante pistach, vetivè, manyòk, yanm ak lot kilti ki kew rache le wap rekolte yo oubye ou fouye te a le wap rekolte yo nan flan mòn yo Laboure te ki nan flan mòn yo Fe kanl koutou pou pemet plis dlo antre nan te a  Plante pye bwa nan jaden yo Koupe pye bwa nan jaden yo Brile te a ak raje ki ladanl Mare bet nan jaden yo pou anrichi te a",0,1,1,0,0,1,1,0,1,1,0,1,0,,,,Wi,Wi,Wi,Wi,Wi,Lòt (Presize),0,0,0,0,0,1,Anyen,,,,,,,,,,,,,,,,,,,,,,,,,,,,,,,,,,"Koupe bwa pou fè chabon Rekòlte fwi oubyen fèy pou bay bèt manje,  Rekolte fwi ak fèy pou manje oubyen fè remèd, ",1,1,0,1,0,0,,,,Wi,Wi,Fèy pou moun manje Grenn pou fè lwil,0,1,0,0,1,0,0,,,,"Non – Si non, pase a Q25.2 ",,,,,,,,,,Wi – Si wi pase a Q25.2.1 ,Mwens ke yon ka tè,0,0,0,1,0,0,Lòt,0,0,0,0,0,0,0,0,1,Mapou,,,Mamit,,Sak pay,,Mamit,,,,,,,,,,,,,,,,,,125,,200,,,,,,,,,,,,,,,,,,,,,,,153662338,dedcb61b-57ca-4198-a6e3-7e0c3d701163,2021-01-22T14:20:43,,1
2020-12-28T13:49:29.440-05:00,2020-12-28T14:18:45.874-05:00,Edouard Jinou,2020-12-28,Petite Rivière de nippes,4PR,Bondeau,"Wi, Si wi pase a Q1 ",Annette Dorsainvil,Fi,Plis ke 55 lane,Primè,Non,,,Agrikilti Chabon ak bwa mang Elvaj,1,1,1,0,0,,,,Se yon rak bwa ki grandi bo lanmè,Wi,Dekrè sou anviwonman (2005) ,0,1,0,0,,,,Wi,Pa koute mangwòv yo,0,1,0,0,,,,"Refij pou fwi lame (kòm pwason, krab ak sirik) repwodwi oubyen grandi ",0,0,0,0,1,0,0,,,,Wi,Kominote ap mal eksplwate mangwòv yo (Yo koupe yo twòp pou fe chabon ak kay),0,1,0,0,0,0,0,,,,Wi,Edikasyon ak sansibilizsyon popilasyon an sou jan yo dwe eksplwate l Met sou pye yon komite jesyon,0,1,0,0,0,1,0,0,0,0,,,,Mayi Pwa Kongo Pitimi Lòt (Presize),1,1,0,1,0,0,0,0,0,1,Melon,,,Bay oksijèn pou moun respire byen  Pemèt dlo rantre byen nan tè a Pwoteksyon kont gwo van (briz van) ,0,1,0,0,0,1,0,0,1,0,,,,Brile te a ak raje ki ladanl Mete fimye nan plant yo Mare bet nan jaden yo pou anrichi te a,0,0,0,0,0,0,0,0,0,1,1,1,0,,,,Non,Wi,Wi,Wi,Wi,Lòt (Presize),0,0,0,0,0,1,Anyen,,,,,,,,,,,,,,,,,,,,,,,,,,,,,,,,,,"Pran bwa sèch pou fè manje Koupe bwa pou fè chabon Koupe bwa pou konstriksyon, ",0,0,1,1,1,0,,,,Wi,Wi,Fèy pou moun manje Grenn pou fè lwil,0,1,0,0,1,0,0,,,,Wi – Si wi pase a Q25.1 ,Aliman kòm legim Kloti,1,0,1,0,0,,,,Wi – Si wi pase a Q25.2.1 ,Mwens ke yon ka tè,0,0,0,1,0,0,Bondeau (4e PR),1,0,0,0,0,0,0,0,0,,,,Mamit,,Mamit,,Mamit,,Lòt ( presize),Douzèn ,,,,,,,,,,,,,,,125,25,500,1000,,,,,,,,,,,,,,,,,,,,,,153662340,bbb3c5d7-98fa-4aa6-9d3d-786438542db1,2021-01-22T14:20:44,,2
2021-01-02T11:42:50.999-05:00,2021-01-02T12:07:50.324-05:00,Alison Pinchinat,2021-01-02,Payan,2Pa,Kafoudan,"Wi, Si wi pase a Q1 ",Jn thony Brice,Gason,Ant 35 ak 55 lane,Segondè,Wi,37710935,Wi,Agrikilti Lòt (Presize),1,0,0,0,1,Biznis,,,Se yon rak bwa ki grandi bo lanmè,"Non – Si non, pase a Q9",,,,,,,,,,,,,,,,,,"Se espas kote anpil zwazo viv ak repwodwi Refij pou fwi lame (kòm pwason, krab ak sirik) repwodwi oubyen grandi ",0,0,0,1,1,0,0,,,,Wi,"Kominote ap mal eksplwate mangwòv yo (Yo koupe yo twòp pou fe chabon ak kay) Mangwòv yo ap fin konble ak tè ki soti nan tèt mòn yo akoz ewozyon  Yo jete anpil fatra (dechè plastik, vye materyo konstriksyon) nan espas mangwòv yo ",0,1,1,0,0,1,0,,,,Wi,Itilize espas mangwòv yo pou bay moun yo lot resous tankou elvaj myèl Met sou pye yon komite jesyon Elabore yon plan jesyon ak amenajman kominotè ,1,1,1,0,0,0,0,0,0,0,,,,Yanm Pwa (pwa nwa ak lot varyete),0,0,0,0,1,0,1,0,0,0,,,,Bay oksijèn pou moun respire byen  Pwoteksyon kont gwo van (briz van)  Pwoteksyon kont inondasyon Kenbe tè yo kont ewozyon ,1,0,0,0,0,1,0,1,1,0,,,,"Plante pistach, vetivè, manyòk, yanm ak lot kilti ki kew rache le wap rekolte yo oubye ou fouye te a le wap rekolte yo nan flan mòn yo Laboure te ki nan flan mòn yo Fe misek pou pwoteje tè a kont erozyon Fe ranp vivan pou pwoteje te yo kon ewozyon Plante pye bwa nan jaden yo Plante banbou nan flan mon yo, bo rivye pou kenbe te yo Mete fimye nan plant yo",0,1,1,1,1,0,1,1,0,0,1,0,0,,,,Wi,Wi,Wi,Wi,Wi,"Koupe bwa sèch, ",0,0,1,0,0,0,,,,,,,,,,,,,,Pou fè manje,0,1,0,0,,,,,,,,,,,,,,,,,"Rekolte fwi ak fèy pou manje oubyen fè remèd,  Pran bwa sèch pou fè manje",1,0,1,0,0,0,,,,Wi,Non,"Fèy pou fè poud   Fèy pou moun manje Flè, grenn konn itilize kòm remèd (te) ",0,1,0,1,0,1,0,,,,Wi – Si wi pase a Q25.1 ,Aliman kòm legim,0,0,1,0,0,,,,Wi – Si wi pase a Q25.2.1 ,Yon kawo tè Yon ka tè (1/4),1,0,1,0,0,0,Lòt,0,0,0,0,0,0,0,0,1,Liwon anlè lebren 2Pa,Nan lwisen 2Pa,,Sak,,Mamit,,Sak,,,,,,,,,,,,,,,,,,10,30,8,,,,,,,,,,,,,,,,,,,,,,,153662346,e5de6166-c720-4575-a56f-66702fc3a1fe,2021-01-22T14:20:45,,3
2021-01-09T16:42:39.685-05:00,2021-01-09T16:59:42.473-05:00,Alison Pinchinat,2021-01-09,Payan,2Pa,Kafoudan,"Wi, Si wi pase a Q1 ",Wildor Victor,Gason,Ant 35 ak 55 lane,Segondè,Wi,31653626,Wi,Agrikilti Lòt (Presize),1,0,0,0,1,Ansenyan,,,Mwen pa konnen – Pase a Q13,,,,,,,,,,,,,,,,,,,,,,,,,,,,,,,,,,,,,,,,,,,,,,,,,,,,,,,,,Pwa (pwa nwa ak lot varyete) Mayi Yanm,1,0,0,0,1,0,1,0,0,0,,,,Bay oksijèn pou moun respire byen  Mwen pa konnen Kenbe tè yo kont ewozyon ,1,0,0,0,0,1,1,0,0,0,,,,"Plante pistach, vetivè, manyòk, yanm ak lot kilti ki kew rache le wap rekolte yo oubye ou fouye te a le wap rekolte yo nan flan mòn yo Laboure te ki nan flan mòn yo Fe kanl koutou pou pemet plis dlo antre nan te a  Plante pye bwa nan jaden yo Koupe pye bwa nan jaden yo Mete fimye nan plant yo Mare bet nan jaden yo pou anrichi te a",0,1,1,0,0,1,1,0,1,0,1,1,0,,,,Non,Wi,Wi,Wi,Wi,,,,,,,,,,,,,,,,,,,,,,,,,,,,,,,,,,,,,,,,,,"Rekolte fwi ak fèy pou manje oubyen fè remèd,  Koupe bwa pou konstriksyon, ",1,0,0,0,1,0,,,,Wi,Non,"Fèy pou moun manje Grenn pou fè lwil Flè, grenn konn itilize kòm remèd (te) ",0,1,0,0,1,1,0,,,,Wi – Si wi pase a Q25.1 ,Aliman kòm legim,0,0,1,0,0,,,,Wi – Si wi pase a Q25.2.1 ,Yon kawo tè,1,0,0,0,0,0,Lòt,0,0,0,0,0,0,0,0,1,Kafoudan (lavale),,,Mamit,,Sak,,Mamit,,,,,,,,,,,,Mamit,,,,,,75,400,50,,,,,,,,,,,,,,,,,,,,,,,153662348,fc116501-7ceb-469a-a2e4-064aa57a053b,2021-01-22T14:20:46,,4
2021-01-11T19:10:00.910-05:00,2021-01-11T19:17:06.823-05:00,Alison pinchinat,2021-01-11,Payan,2pa,Dadye,"Wi, Si wi pase a Q1 ",Merveille Pierre Richard,Gason,Ant 35 ak 55 lane,Primè,Wi,37851162,Non,Agrikilti Lòt (Presize),1,0,0,0,1,Mason,,,Se yon rak bwa ki grandi bo lanmè,"Non – Si non, pase a Q9",,,,,,,,,,,,,,,,,,"Refij pou fwi lame (kòm pwason, krab ak sirik) repwodwi oubyen grandi ",0,0,0,0,1,0,0,,,,Wi,Kominote ap mal eksplwate mangwòv yo (Yo koupe yo twòp pou fe chabon ak kay),0,1,0,0,0,0,0,,,,"Non – SI non, pase a Q12",,,,,,,,,,,,,,,Pwa Kongo,0,0,0,1,0,0,0,0,0,0,,,,Kenbe tè yo kont ewozyon  Bay manje pou moun ak bet Bay oksijèn pou moun respire byen ,1,0,1,0,0,1,0,0,0,0,,,,Mare bet nan jaden yo pou anrichi te a Mete fimye nan plant yo Fe ranp vivan pou pwoteje te yo kon ewozyon Fe kanl koutou pou pemet plis dlo antre nan te a ,0,0,0,0,1,1,0,0,0,0,1,1,0,,,,Wi,Wi,Wi,Wi,Wi,,,,,,,,,,,,,,,,,,,,,,,,,,,,,,,,,,,,,,,,,,Pran bwa sèch pou fè manje Lòt (presize),0,0,1,0,0,1,Netwaye yo,,,Wi,Wi,Fèy pou moun manje,0,1,0,0,0,0,0,,,,Wi – Si wi pase a Q25.1 ,Aliman kòm legim,0,0,1,0,0,,,,Wi – Si wi pase a Q25.2.1 ,Yon ka tè (1/4),0,0,1,0,0,0,Lòt,0,0,0,0,0,0,0,0,1,Dadye,,,Mamit,,,,,,,,,,,,,,,,,,,,,,200,,,,,,,,,,,,,,,,,,,,,,,,,153662350,a550d37d-3747-4ff5-a0cd-f61d9c898d36,2021-01-22T14:20:46,,5
2021-01-11T19:17:59.949-05:00,2021-01-11T19:24:38.448-05:00,Alison pinchinat,2021-01-11,Payan,2pa,Kafoudan,"Wi, Si wi pase a Q1 ",Carlo pinchinat,Gason,Ant 25 ak 35 lane,Segondè,Wi,49360558,Wi,Agrikilti Elvaj,1,1,0,0,0,,,,Se yon rak bwa ki grandi bo lanmè,"Non – Si non, pase a Q9",,,,,,,,,,,,,,,,,,"Refij pou fwi lame (kòm pwason, krab ak sirik) repwodwi oubyen grandi ",0,0,0,0,1,0,0,,,,Wi,Kominote ap mal eksplwate mangwòv yo (Yo koupe yo twòp pou fe chabon ak kay),0,1,0,0,0,0,0,,,,Wi,Met sou pye yon komite jesyon,0,1,0,0,0,0,0,0,0,0,,,,Pwa Kongo Mayi Lòt (Presize),1,0,0,1,0,0,0,0,0,1,Joumou ,Melon,,Pemèt dlo rantre byen nan tè a Bay manje pou moun ak bet Bay oksijèn pou moun respire byen ,0,1,1,0,0,1,0,0,0,0,,,,Mete fimye nan plant yo Mare bet nan jaden yo pou anrichi te a Fe misek pou pwoteje tè a kont erozyon,0,0,0,1,0,0,0,0,0,0,1,1,0,,,,Wi,Wi,Wi,Wi,Wi,,,,,,,,,,,,,,,,,,,,,,,,,,,,,,,,,,,,,,,,,,Lòt (presize),0,0,0,0,0,1,Netwaye yo,,,Wi,Non,Fèy pou moun manje Fèy pou fè poud  ,0,1,0,1,0,0,0,,,,Wi – Si wi pase a Q25.1 ,Aliman kòm legim,0,0,1,0,0,,,,Wi – Si wi pase a Q25.2.1 ,Yon ka tè (1/4),0,0,1,0,0,0,Kafoudan (2e P),0,0,0,0,0,0,0,1,0,,,,Lòt ( presize),Kabawo,Mamit,,,,,,,,,,,,,,,,,,,,400,,,,,,,,,,,,,,,,,,,,,,,,,153662354,8b5d1aae-14dd-4b40-b36d-0ca24e70b043,2021-01-22T14:20:47,,6
2021-01-11T19:28:27.306-05:00,2021-01-11T19:33:25.028-05:00,Alison Pinchinat,2021-01-11,Payan,2pa,Malis,"Wi, Si wi pase a Q1 ",Merveille maxine,Gason,Ant 25 ak 35 lane,Primè,Wi,44275451,Non,Agrikilti,1,0,0,0,0,,,,Se yon rak bwa ki grandi bo lanmè,"Non – Si non, pase a Q9",,,,,,,,,,,,,,,,,,"Refij pou fwi lame (kòm pwason, krab ak sirik) repwodwi oubyen grandi ",0,0,0,0,1,0,0,,,,Wi,Kominote ap mal eksplwate mangwòv yo (Yo koupe yo twòp pou fe chabon ak kay),0,1,0,0,0,0,0,,,,"Non – SI non, pase a Q12",,,,,,,,,,,,,,,Mayi Pwa (pwa nwa ak lot varyete),1,0,0,0,1,0,0,0,0,0,,,,Kenbe tè yo kont ewozyon  Bay manje pou moun ak bet Bay oksijèn pou moun respire byen ,1,0,1,0,0,1,0,0,0,0,,,,Koupe pye bwa nan jaden yo Mare bet nan jaden yo pou anrichi te a Mete fimye nan plant yo,0,0,0,0,0,0,0,0,1,0,1,1,0,,,,Non,Wi,Wi,Wi,Wi,,,,,,,,,,,,,,,,,,,,,,,,,,,,,,,,,,,,,,,,,,Koupe bwa pou fè chabon,0,0,0,1,0,0,,,,Wi,Non,Fèy pou moun manje,0,1,0,0,0,0,0,,,,Wi – Si wi pase a Q25.1 ,Aliman kòm legim,0,0,1,0,0,,,,Wi – Si wi pase a Q25.2.1 ,Yon ka tè (1/4),0,0,1,0,0,0,Lòt,0,0,0,0,0,0,0,0,1,Kamalis,,,Mamit,,Mamit,,,,,,,,,,,,,,,,,,,,200,,,,,,,,,,,,,,,,,,,,,,,,,153662355,2e269d90-10ed-42fd-b5c5-37053f492129,2021-01-22T14:20:48,,7
